<?xml version="1.0" encoding="UTF-8"?>
<!DOCTYPE list SYSTEM "../templates/instances.dtd">
<instance name="Kamaloka-23">
  <activityTime val="30"/>
  <timeDelay val="24"/>
  <allowSummon val="false"/>
  <emptyDestroyTime val="300"/>
  <returnteleport x="-13870" y="123767" z="-3117"/>
  <spawnlist>
    <spawn npcId="18554" x="-56255" y="-219879" z="-8117" heading="0" respawn="0" amount="1"/>
  </spawnlist>
</instance>